{
  "schema_version": "pdx_runtime_provider_workflow_receipt_v2",
  "receipt_id": "workflow_receipt_001", "workflow_job_id": "workflow_dispatch_001", "task_id": "task_dispatch_001", "run_id": "run_parent_001",
  "plan_digest": "1b6c9b22e7ab7e4cb691c4fe637e9bdff4e4ecb5cd46721358476540bc3ca67f",
  "status": "completed",
  "step_receipts": [
    {"workflow_step_id": "step_decision_001", "step_kind": "builder", "attempt_number": 1, "status": "succeeded", "execution_constraints_digest": "5555555555555555555555555555555555555555555555555555555555555555"},
    {"workflow_step_id": "step_dispatch_001", "step_kind": "dispatch", "attempt_number": 1, "status": "succeeded", "execution_constraints_digest": "6666666666666666666666666666666666666666666666666666666666666666", "dispatch_receipt_artifact": {"schema_version": "prodocux_opaque_artifact_v1", "artifact_id": "dispatch_receipt_001", "uri": "artifact://dispatch/receipts/dispatch-001.json", "sha256": "7777777777777777777777777777777777777777777777777777777777777777", "size_bytes": 2048, "media_type": "application/json"}},
    {"workflow_step_id": "step_review_001", "step_kind": "reviewer", "attempt_number": 1, "status": "succeeded", "execution_constraints_digest": "8888888888888888888888888888888888888888888888888888888888888888"}
  ],
  "artifact_edges": [
    {"edge_id": "edge_decision_001", "artifact_role": "decision_receipt", "artifact": {"schema_version": "prodocux_opaque_artifact_v1", "artifact_id": "decision_receipt_001", "uri": "artifact://dispatch/receipts/decision-001.json", "sha256": "9999999999999999999999999999999999999999999999999999999999999999", "size_bytes": 1024, "media_type": "application/json"}, "artifact_identity_digest": "d5b904b5595e5be21326d42a9cf03df91fc598e7bf11a697d6950b0379db905a", "producer_step_id": "step_decision_001", "producer_attempt_number": 1, "consumer_step_id": "step_dispatch_001", "recorded_once": true},
    {"edge_id": "edge_dispatch_receipt_001", "artifact_role": "dispatch_receipt", "artifact": {"schema_version": "prodocux_opaque_artifact_v1", "artifact_id": "dispatch_receipt_001", "uri": "artifact://dispatch/receipts/dispatch-001.json", "sha256": "7777777777777777777777777777777777777777777777777777777777777777", "size_bytes": 2048, "media_type": "application/json"}, "artifact_identity_digest": "4c5e66a273bd44cac3a965474f13c0a19ec2e38048be1b4b29230b7b39f5a88f", "producer_step_id": "step_dispatch_001", "producer_attempt_number": 1, "consumer_step_id": "step_review_001", "recorded_once": true},
    {"edge_id": "edge_dispatch_output_001", "artifact_role": "dispatch_output", "artifact": {"schema_version": "prodocux_opaque_artifact_v1", "artifact_id": "dispatch_output_001", "uri": "artifact://dispatch/outputs/result-001.json", "sha256": "aaaaaaaaaaaaaaaaaaaaaaaaaaaaaaaaaaaaaaaaaaaaaaaaaaaaaaaaaaaaaaaa", "size_bytes": 128, "media_type": "application/json"}, "artifact_identity_digest": "d7964c47779453f7ef0870051dfc5146f89b9ee39448a309150733ac2e2cb7ff", "producer_step_id": "step_dispatch_001", "producer_attempt_number": 1, "consumer_step_id": "step_review_001", "recorded_once": true}
  ],
  "authority_records": [],
  "final_counters": {"provider_attempts": 2, "check_attempts": 0, "dispatch_attempts": 1, "active_steps": 0, "active_dispatches": 0, "repair_iterations": 0, "total_runtime_seconds": 20, "dispatch_runtime_seconds": 3, "total_event_bytes": 256, "total_artifact_bytes": 3200, "cross_step_artifact_edges": 3, "external_operations": 1},
  "recorded_at": "2026-10-03T12:05:00Z"
}
